{
  "schemaVersion": "1.0",
  "requestId": "trace-1",
  "snapshot": {
    "snapshotId": "snap-short-links-1",
    "source": "admin/short-links",
    "observedAt": "2026-07-17T02:00:00Z",
    "expiresAt": "2026-07-17T02:05:00Z",
    "contentHash": "sha256:ea37044dd349379395be7b51a1e4b044f1bbc36f794ae4055666fa72995e878a"
  },
  "data": {
    "gid": "g1",
    "current": 2,
    "size": 2,
    "total": 3,
    "pages": 2,
    "hasNext": false,
    "sort": "TOTAL_PV_DESC",
    "records": [
      {
        "fullShortUrl": "nurl.ink/a",
        "describe": "Launch",
        "validity": "CUSTOM",
        "expiresAt": "2026-08-01T00:00:00Z",
        "createdAt": "2026-07-10T01:00:00Z",
        "todayPv": 12,
        "todayUv": 8,
        "todayUip": 7,
        "totalPv": 120,
        "totalUv": 80,
        "totalUip": 70
      }
    ]
  },
  "warnings": []
}
